{
  "encounter_id": "E-20831",
  "age": 58,
  "chief_complaint": "chest pain",
  "vitals": [
    "BP 158/96",
    "HR 104",
    "SpO2 94%"
  ],
  "symptoms": [
    "Crushing substernal chest pain radiating to the left arm",
    "Onset 40 minutes ago, diaphoretic"
  ],
  "internal_notes": "Roommate in bay 3, J. Alvarez, is HIV+ and on methadone — do not chart here."
}